{
  "$schema": "https://json-schema.org/draft/2020-12/schema",
  "$id": "https://dime.internal/schemas/foundation_ai_reviewer_provisioning_input.schema.json",
  "title": "Dime Foundation AI Reviewer Provisioning Input",
  "description": "Public-only inputs used to prepare an inactive candidate reviewer registry. Private signing keys are prohibited.",
  "type": "object",
  "additionalProperties": false,
  "required": [
    "schema_version",
    "source_registry_sha256",
    "target_registry_version",
    "reviewers"
  ],
  "properties": {
    "schema_version": {
      "const": "dime-foundation-ai-reviewer-provisioning-input-v1"
    },
    "source_registry_sha256": {
      "$ref": "#/$defs/sha256"
    },
    "target_registry_version": {
      "type": "string",
      "pattern": "^dime-foundation-reviewers-v[0-9]+\\.[0-9]+\\.[0-9]+$"
    },
    "reviewers": {
      "type": "array",
      "minItems": 2,
      "maxItems": 2,
      "uniqueItems": true,
      "items": {
        "$ref": "#/$defs/reviewerProvisioning"
      }
    }
  },
  "$defs": {
    "reviewerProvisioning": {
      "type": "object",
      "additionalProperties": false,
      "required": [
        "reviewer_id",
        "profile_id",
        "model_provider",
        "model_id",
        "model_revision",
        "runtime_version",
        "model_lineage_id",
        "policy_lineage_id",
        "workload_identity_id",
        "system_instruction_path",
        "tool_contract_path",
        "inference_policy_path",
        "conflict_policy_path",
        "recusal_policy_path",
        "receipt_verification_key",
        "possession_proof_signature_base64"
      ],
      "properties": {
        "reviewer_id": {
          "type": "string",
          "pattern": "^dime-reviewer-[a-z0-9][a-z0-9._-]{7,63}$"
        },
        "profile_id": {
          "type": "string",
          "pattern": "^dime-agent-profile-[a-z0-9][a-z0-9._-]{7,63}$"
        },
        "model_provider": {
          "$ref": "#/$defs/pinnedIdentity"
        },
        "model_id": {
          "$ref": "#/$defs/pinnedIdentity"
        },
        "model_revision": {
          "$ref": "#/$defs/immutableRevision"
        },
        "runtime_version": {
          "$ref": "#/$defs/immutableRevision"
        },
        "model_lineage_id": {
          "$ref": "#/$defs/pinnedIdentity"
        },
        "policy_lineage_id": {
          "$ref": "#/$defs/pinnedIdentity"
        },
        "workload_identity_id": {
          "$ref": "#/$defs/pinnedIdentity"
        },
        "system_instruction_path": {
          "$ref": "#/$defs/relativePath"
        },
        "tool_contract_path": {
          "$ref": "#/$defs/relativePath"
        },
        "inference_policy_path": {
          "$ref": "#/$defs/relativePath"
        },
        "conflict_policy_path": {
          "$ref": "#/$defs/relativePath"
        },
        "recusal_policy_path": {
          "$ref": "#/$defs/relativePath"
        },
        "receipt_verification_key": {
          "$ref": "#/$defs/receiptVerificationKey"
        },
        "possession_proof_signature_base64": {
          "oneOf": [
            {
              "type": "string",
              "pattern": "^[A-Za-z0-9+/]{86}==$"
            },
            {
              "type": "null"
            }
          ]
        }
      }
    },
    "pinnedIdentity": {
      "type": "string",
      "minLength": 1,
      "maxLength": 160,
      "not": {
        "pattern": "(?:^|[-_.:/])(?:replace|placeholder|example|sample|test|tbd|todo|unknown|latest|unassigned|main|master|stable|current|head)(?:$|[-_.:/])"
      }
    },
    "immutableRevision": {
      "type": "string",
      "pattern": "^(?:[0-9a-f]{40}|[0-9a-f]{64})$",
      "description": "A full content-addressed commit or artifact digest. Tags, aliases, dates, and semantic versions are prohibited."
    },
    "relativePath": {
      "type": "string",
      "minLength": 1,
      "maxLength": 240,
      "pattern": "^[A-Za-z0-9][A-Za-z0-9._/-]*$",
      "not": {
        "pattern": "(?:^/|^\\.\\.?/|/\\.\\.?/|/\\.\\.?$|//)"
      }
    },
    "sha256": {
      "type": "string",
      "pattern": "^[0-9a-f]{64}$"
    },
    "receiptVerificationKey": {
      "type": "object",
      "additionalProperties": false,
      "required": [
        "algorithm",
        "encoding",
        "public_key_base64",
        "public_key_sha256",
        "status",
        "valid_from_utc",
        "valid_until_or_open_ended"
      ],
      "properties": {
        "algorithm": {
          "const": "ed25519"
        },
        "encoding": {
          "const": "raw-base64"
        },
        "public_key_base64": {
          "type": "string",
          "pattern": "^[A-Za-z0-9+/]{43}=$"
        },
        "public_key_sha256": {
          "$ref": "#/$defs/sha256"
        },
        "status": {
          "const": "active"
        },
        "valid_from_utc": {
          "type": "string",
          "format": "date-time",
          "pattern": "^\\d{4}-\\d{2}-\\d{2}T\\d{2}:\\d{2}:\\d{2}Z$"
        },
        "valid_until_or_open_ended": {
          "oneOf": [
            {
              "type": "string",
              "format": "date-time",
              "pattern": "^\\d{4}-\\d{2}-\\d{2}T\\d{2}:\\d{2}:\\d{2}Z$"
            },
            {
              "type": "null"
            }
          ]
        }
      }
    }
  }
}
